[
  {
    "id": "oak_tree",
    "name": "Oak Tree",
    "kind": "tree",
    "size": [5, 7, 5],
    "anchor": "surface",
    "palette": ["oak_log", "oak_leaves"],
    "blocks": [
      {"p": [2,0,2], "b": 0},
      {"p": [2,1,2], "b": 0},
      {"p": [2,2,2], "b": 0},
      {"p": [2,3,2], "b": 0},
      {"p": [1,3,1], "b": 1}, {"p": [2,3,1], "b": 1}, {"p": [3,3,1], "b": 1},
      {"p": [1,3,2], "b": 1}, {"p": [3,3,2], "b": 1},
      {"p": [1,3,3], "b": 1}, {"p": [2,3,3], "b": 1}, {"p": [3,3,3], "b": 1},
      {"p": [1,4,1], "b": 1}, {"p": [2,4,1], "b": 1}, {"p": [3,4,1], "b": 1},
      {"p": [1,4,2], "b": 1}, {"p": [2,4,2], "b": 1}, {"p": [3,4,2], "b": 1},
      {"p": [1,4,3], "b": 1}, {"p": [2,4,3], "b": 1}, {"p": [3,4,3], "b": 1},
      {"p": [2,5,2], "b": 1}, {"p": [1,5,2], "b": 1}, {"p": [3,5,2], "b": 1},
      {"p": [2,5,1], "b": 1}, {"p": [2,5,3], "b": 1}
    ]
  },
  {
    "id": "birch_tree",
    "name": "Birch Tree",
    "kind": "tree",
    "size": [5, 8, 5],
    "anchor": "surface",
    "palette": ["birch_log", "birch_leaves"],
    "blocks": [
      {"p": [2,0,2], "b": 0},
      {"p": [2,1,2], "b": 0},
      {"p": [2,2,2], "b": 0},
      {"p": [2,3,2], "b": 0},
      {"p": [2,4,2], "b": 0},
      {"p": [1,4,1], "b": 1}, {"p": [2,4,1], "b": 1}, {"p": [3,4,1], "b": 1},
      {"p": [1,4,2], "b": 1}, {"p": [3,4,2], "b": 1},
      {"p": [1,4,3], "b": 1}, {"p": [2,4,3], "b": 1}, {"p": [3,4,3], "b": 1},
      {"p": [1,5,1], "b": 1}, {"p": [2,5,1], "b": 1}, {"p": [3,5,1], "b": 1},
      {"p": [1,5,2], "b": 1}, {"p": [2,5,2], "b": 1}, {"p": [3,5,2], "b": 1},
      {"p": [1,5,3], "b": 1}, {"p": [2,5,3], "b": 1}, {"p": [3,5,3], "b": 1},
      {"p": [2,6,2], "b": 1}, {"p": [1,6,2], "b": 1}, {"p": [3,6,2], "b": 1},
      {"p": [2,6,1], "b": 1}, {"p": [2,6,3], "b": 1}
    ]
  },
  {
    "id": "starter_village",
    "name": "Starter Village",
    "kind": "village",
    "size": [20, 8, 20],
    "anchor": "surface",
    "palette": ["oak_planks", "cobblestone", "oak_log", "stone_brick", "glass_pane", "torch", "chest", "crafting_table", "oak_door"],
    "blocks": [
      {"p": [2,0,2], "b": 1}, {"p": [3,0,2], "b": 1}, {"p": [4,0,2], "b": 1}, {"p": [5,0,2], "b": 1},
      {"p": [2,0,3], "b": 1}, {"p": [5,0,3], "b": 1},
      {"p": [2,0,4], "b": 1}, {"p": [5,0,4], "b": 1},
      {"p": [2,0,5], "b": 1}, {"p": [3,0,5], "b": 1}, {"p": [4,0,5], "b": 1}, {"p": [5,0,5], "b": 1},
      {"p": [2,1,2], "b": 2}, {"p": [5,1,2], "b": 2},
      {"p": [2,1,5], "b": 2}, {"p": [5,1,5], "b": 2},
      {"p": [3,1,2], "b": 0}, {"p": [4,1,2], "b": 4},
      {"p": [3,0,5], "b": 8},
      {"p": [3,1,3], "b": 7}, {"p": [4,1,3], "b": 6},
      {"p": [4,1,4], "b": 5},
      {"p": [10,0,2], "b": 1}, {"p": [11,0,2], "b": 1}, {"p": [12,0,2], "b": 1}, {"p": [13,0,2], "b": 1},
      {"p": [10,0,3], "b": 1}, {"p": [13,0,3], "b": 1},
      {"p": [10,0,4], "b": 1}, {"p": [13,0,4], "b": 1},
      {"p": [10,0,5], "b": 1}, {"p": [11,0,5], "b": 1}, {"p": [12,0,5], "b": 1}, {"p": [13,0,5], "b": 1},
      {"p": [10,1,2], "b": 2}, {"p": [13,1,2], "b": 2},
      {"p": [10,1,5], "b": 2}, {"p": [13,1,5], "b": 2},
      {"p": [11,1,2], "b": 4},
      {"p": [11,0,5], "b": 8},
      {"p": [11,1,3], "b": 6}
    ],
    "loot": ["village_chest"],
    "npcs": ["elder_mira", "builder_tom", "herbalist_lena"]
  },
  {
    "id": "dim_dungeon",
    "name": "Dim Dungeon",
    "kind": "dungeon_lite",
    "size": [12, 6, 12],
    "anchor": "underground",
    "palette": ["dim_stone", "mossy_stone", "stone_brick", "torch", "chest"],
    "blocks": [
      {"p": [0,0,0], "b": 0}, {"p": [1,0,0], "b": 0}, {"p": [2,0,0], "b": 0},
      {"p": [0,0,1], "b": 0}, {"p": [2,0,1], "b": 1},
      {"p": [0,0,2], "b": 0}, {"p": [1,0,2], "b": 0}, {"p": [2,0,2], "b": 0},
      {"p": [1,1,0], "b": 3}, {"p": [1,1,2], "b": 3},
      {"p": [0,1,1], "b": 3}, {"p": [2,1,1], "b": 3},
      {"p": [1,2,1], "b": 2},
      {"p": [2,2,2], "b": 4}
    ],
    "loot": ["dungeon_chest"]
  },
  {
    "id": "beacon_shrine",
    "name": "Beacon Shrine",
    "kind": "beacon_shrine",
    "size": [9, 10, 9],
    "anchor": "surface",
    "palette": ["stone_brick", "cobblestone", "beacon_block", "torch", "crystal_lamp"],
    "blocks": [
      {"p": [4,0,4], "b": 2},
      {"p": [4,1,4], "b": 0}, {"p": [3,1,4], "b": 0}, {"p": [5,1,4], "b": 0},
      {"p": [4,1,3], "b": 0}, {"p": [4,1,5], "b": 0},
      {"p": [2,0,2], "b": 1}, {"p": [6,0,2], "b": 1},
      {"p": [2,0,6], "b": 1}, {"p": [6,0,6], "b": 1},
      {"p": [2,1,2], "b": 3}, {"p": [6,1,2], "b": 3},
      {"p": [2,1,6], "b": 3}, {"p": [6,1,6], "b": 3},
      {"p": [4,2,4], "b": 4}
    ]
  }
]
